shot,description
shot_0093.jpg,"A blurry, grainy image shows the backs of people's heads and shoulders, some wearing light-colored shirts."
shot_0089.jpg,"A blurry, dark image shows figures and a structure, possibly indoors."
shot_0021.jpg,The image displays a textured surface with shades of purple and pink and some white spots.
shot_0034.jpg,"A blurry, pixelated image with a gradient from yellow-green on the left to blue on the right with black vertical lines throughout."
shot_0027.jpg,"A blurry, blue-toned image shows people, one of whom appears to be playing a drum."
shot_0010.jpg,"A grainy, light purple and white background has dark speckles throughout."
shot_0079.jpg,"A grainy, sepia-toned shot shows a street scene with a large building, a crowd of people holding a banner, and a car in the foreground."
shot_0051.jpg,"A distorted, pixelated image with a blue background and dark, blurry shapes, possibly a figure or a skull, is partially obscured by vertical lines of static."
shot_0058.jpg,"A blurry, abstract image with a mix of blue, purple, and red colors appears damaged or distorted."
shot_0055.jpg,"A digitally distorted image, possibly of trees or a forest, appears with a grainy texture and a color shift towards blue and green, with orange and yellow edges."
shot_0078.jpg,"Three pairs of legs and feet are partially visible, two wearing light-colored shoes and one wearing dark-colored shoes."
shot_0043.jpg,"A blurry, purple-tinted image appears to show a group of people, some with musical instruments, possibly a band."
shot_0066.jpg,"A grainy, low-quality video shows a group of people, some seemingly playing cricket, on a city street."
shot_0023.jpg,A crowd of people on a balcony watches a parade float decorated with balloons and an umbrella.
shot_0092.jpg,"A crowd of people wearing 1970s-era clothing walks down a city street near a large stone building, some carrying purple and gold balloons."
shot_0074.jpg,"Grainy footage shows a person in a purple tank top smiling next to a person wearing a light-colored jersey with a dark letter ""A"" visible."
shot_0030.jpg,"A blurry, grainy, light brown surface with darker shadows is visible."
shot_0042.jpg,"Grainy or distorted footage shows people in what appear to be hats or helmets, possibly working on something."
shot_0022.jpg,"A group of people march down a city street, carrying signs with various slogans, including one that reads ""Shatzi Radical Jewish Lesbians Organizing."""
shot_0031.jpg,"A blurry, purple-tinted image shows a crowd of people and a sign in the background."
shot_0005.jpg,"A man with aviator sunglasses and a mustache looks ahead, with a blurry person visible in the background."
shot_0002.jpg,"A group of people march down a street holding a banner that reads ""BIAN"" (likely the end of ""Lesbian"") in white letters on a maroon background."
shot_0000.jpg,"A blurry, grainy, sepia-toned image shows indistinct figures and objects, possibly from an old film reel."
shot_0013.jpg,"A grainy, purple-toned image resembles a worn film strip with vertical lines and some brighter spots."
shot_0033.jpg,"A distorted, brightly colored image appears to show a person standing on a sidewalk in front of a blurry background that may depict other people and buildings."
shot_0050.jpg,"A distorted, grainy image, likely from a damaged or degraded film or video source, shows blue and gold shapes, potentially depicting a scene with figures or objects."
shot_0025.jpg,"A group of people clap and cheer, some wearing purple shirts, while balloons float above them."
shot_0011.jpg,"A group of people are standing on a city street, some wearing Lee shirts."
shot_0004.jpg,"A white or off-white surface is covered with small, dark specks."
shot_0072.jpg,A group of people wearing USA tank tops and medals are sitting in the back of a convertible.
shot_0024.jpg,"A blurry, blue-tinted image appears to show a crowd of people near a decorated float or vehicle."
shot_0056.jpg,"A blurry, faded, and discolored image appears to depict a crowd of people, possibly at a market or festival, beneath a canopy or awning."
shot_0006.jpg,"A blurry, grainy image shows the backs of people's heads and shoulders."
shot_0036.jpg,"A digitally-altered image features vertical streaks of blue, purple, and white against a black background."
shot_0052.jpg,"A white surface is covered with small, light blue and dark blue speckles."
shot_0062.jpg,"A distorted, colorful abstract image, possibly of a crowd or textured surface, is presented with vertical red borders on either side against a black background."
shot_0084.jpg,"A grainy, slightly faded film shot shows a crowd of people, some wearing light-colored clothing, walking and standing near a building with columns."
shot_0073.jpg,"Three people wearing tank tops, two of which have ""USA"" on them, are sitting in a dark room."
shot_0049.jpg,"A digitally manipulated image shows a textured surface with red and purple abstract shapes resembling figures, possibly affected by digital noise or distortion."
shot_0044.jpg,"A grainy, low-quality film image shows a parade with people in shorts and white shirts walking under a purple and gold balloon arch."
shot_0059.jpg,"A blurry, grainy image displays vertical bands of red, green, and black."
shot_0016.jpg,"A blurry, distorted, reddish image shows a crowd of people from behind."
shot_0041.jpg,"A blurry, low-quality video shows a marching band with purple and white uniforms."
shot_0083.jpg,"A blurry, green-tinted image shows a partial view of a protest sign and possibly a person's head."
shot_0071.jpg,"A blurry, low-light image shows several people, one of whom wears yellow-framed sunglasses."
shot_0017.jpg,"A blurry, dark image shows the faces of two people, one seemingly holding the other."
shot_0026.jpg,"A white background has a scattering of small, faint, colorful specks."
shot_0028.jpg,"A blurry, distorted image, likely from old film, appears to show a building's exterior and doorway."
shot_0019.jpg,"A close-up image shows a textured, purple surface."
shot_0047.jpg,"A blurry, distorted image in blue and yellow appears to show people seated at tables in a dark space."
shot_0064.jpg,"A blurry, pixelated image displays vertical stripes of yellow, green, and light blue, resembling an abstract painting or a distorted digital screen."
shot_0003.jpg,"A blurry, grainy image shows people, some wearing purple, near a wooden structure."
shot_0001.jpg,"A blurry, grainy image appears to show a person's head and shoulders."
shot_0039.jpg,"A blurry, purple-tinted image appears to show a person walking past a police car."
shot_0009.jpg,"A grainy, discolored image shows a group of people, some holding signs, gathered outdoors."
shot_0008.jpg,"A grainy, damaged film image shows a group of people outdoors, some holding a sign, some interacting with each other."
shot_0032.jpg,"Two figures, highlighted in gold and red against a blue background, appear to be bending over."
shot_0018.jpg,"A grainy, purple surface fills most of the frame."
shot_0045.jpg,"Three people are visible in the grainy, distorted image, two appear to be wearing light-colored shirts and one a dark purple shirt."
shot_0085.jpg,"A blurry, purple-tinted image shows a crowd of people."
shot_0087.jpg,A person wearing a purple shirt holds up their arms and a sign.
shot_0088.jpg,"A blurry, grainy image appears to show a person's head and shoulders, possibly wearing a dark-colored garment, along with a blurred background that may include a wall and furniture."
shot_0082.jpg,"A police officer in uniform stands near a concrete pillar, with the back of a person's head visible in the bottom left corner."
shot_0068.jpg,"A blurry, green-tinted image shows a group of people, some of whom are wearing glasses and light-colored shirts."
shot_0048.jpg,"A textured surface, predominantly blue, shows signs of wear, cracks, and what appears to be graffiti."
shot_0067.jpg,"Two people wearing hats are seen in a blurry, discolored image, possibly holding something in their hands."
shot_0007.jpg,"A crowd of people, some holding signs and a green banner, are gathered on a city street."
shot_0035.jpg,"A blurry, grainy image shows dark shapes and areas of yellow and blue."
shot_0086.jpg,"A crowd of people, some wearing purple and gold, and police officers are gathered in front of a stone building, with purple and gold balloons visible."
shot_0012.jpg,"A blurry, grainy image shows a group of people, some wearing sunglasses, seemingly at an outdoor event."
shot_0069.jpg,"Two men hold a banner reading ""New York City Gay Men's"" at what appears to be a parade or public gathering."
shot_0081.jpg,"A blurry, grainy shot shows a parade with a rainbow banner moving down a city street."
shot_0020.jpg,"A grainy, dark purple surface fills most of the frame, with black bars on the left and right sides."
shot_0014.jpg,"Two men with mustaches stand close together, smiling, in a room with a window and wooden walls."
shot_0057.jpg,"A blurry, distorted image with vertical lines of color resembling a damaged film or video still is visible."
shot_0063.jpg,"A few faint, small bluish dots are visible against a black background."
shot_0094.jpg,"A blurry, grainy image shows the backs of several people's heads, and the profile of a man wearing glasses facing to the right."
shot_0065.jpg,"Two men, one shirtless and wearing sunglasses, and the other wearing a dark shirt and sunglasses, stand in a room with a map on the wall."
shot_0029.jpg,"A blurry, discolored close-up shows part of a person's body and clothing with a circular design or object."
shot_0076.jpg,"A blurry, grainy image shows a person wearing a white shirt, with another person visible behind them wearing a hat."
shot_0091.jpg,"A blurry, grainy image shows people in what appears to be a theater or auditorium setting, with some sitting and some standing."
shot_0061.jpg,"A dark image with faint, blurry, purple shapes near the bottom center."
shot_0038.jpg,"A blurry, pixelated image appears to show the profile of a person's face against a textured backdrop."
shot_0054.jpg,"A blurry, pixelated image shows green and brown shapes against a teal background, with vertical lines running through it."
shot_0015.jpg,"A close-up image features a predominantly blue surface with vertical streaks and a textured, mottled appearance."
shot_0040.jpg,"A blurry, purple-tinted video shows a group of people, some holding a banner that reads ""GAY""."
shot_0090.jpg,"A blurry, yellow-tinted image shows a group of people, some of whom appear to be wearing hats."
shot_0080.jpg,"Grainy footage shows people marching in a parade, with some carrying a large flag or banner."
shot_0095.jpg,"A grainy, sepia-toned image depicts a crowd of people, some in shorts and tank tops, gathered outside a building, with a person wearing roller skates and a skirt in the foreground."
shot_0037.jpg,"A distorted, digitally manipulated image features blue and white vertical lines and blurry shapes."
shot_0046.jpg,"A blurry, distorted, and heavily pixelated image in shades of blue and purple seems to depict a group of people."
shot_0077.jpg,"A blurry, sepia-toned image shows people, possibly in costumes, standing near a railing or barrier."
shot_0070.jpg,"A grainy, purple-toned image shows a person wearing glasses looking up."
shot_0060.jpg,A dark image with vertical red lines on either side and a textured appearance.
shot_0075.jpg,A man holds a stick while wearing a yellow t-shirt.
shot_0053.jpg,"A grainy, textured image features vertical lines and blotches of red, pink, and blue-green."
